A.1.14,Acquisition of shares under Scheme of Merger / Amalgamation,A.1.14,14,"Mergers and amalgamations of companies in India are usually governed by an order issued by a competent Court on the basis of the Scheme submitted by the companies undergoing merger/amalgamation. Once the scheme of merger or amalgamation of two or more Indian companies has been approved by a Court in India, the transferee company or new company is allowed to issue shares to the shareholders of the transferor company resident outside India, subject to the conditions that :

the percentage of shareholding of persons resident outside India in the transferee or new company does not exceed the sectoral cap, and

the transferor company or the transferee or the new company is not engaged in activities which are prohibited under the FDI policy (refer para 7(c)",,,,,,,,,,,,,,,,,,,,,,,,,,,,,,,,,,,,,,,,,,,,,,,,,,,,,,,,,,,,,,,,,,,,,,,,,,,,,,,,,,,,,,,,,,,,,,,,,,,,,,,,,,,,,,,,,,,,,,,,,,,,,,,,,,,,,,,,,,,,,,,,,,,,,,,,,,,,,,,,,,,,,,,,,,,,,,,,,,,,,,,,,,,,,,,,,,,,,,,,,,,,,,,,,,,,,,,,,,,,,,,,,,,,,,,,,,,,,,,,,,,,,,,,,,,
A.1.15, Remittance of sale proceeds,A.1.15,15,"AD Category – I bank can allow the remittance of sale proceeds of a security (net of applicable taxes) to the seller of shares resident outside India, provided the security has been held on repatriation basis, the sale of security has been made in accordance with the prescribed guidelines and NOC / tax clearance certificate from the Income Tax Department has been produced.",,,,,,,,,,,,,,,,,,,,,,,,,,,,,,,,,,,,,,,,,,,,,,,,,,,,,,,,,,,,,,,,,,,,,,,,,,,,,,,,,,,,,,,,,,,,,,,,,,,,,,,,,,,,,,,,,,,,,,,,,,,,,,,,,,,,,,,,,,,,,,,,,,,,,,,,,,,,,,,,,,,,,,,,,,,,,,,,,,,,,,,,,,,,,,,,,,,,,,,,,,,,,,,,,,,,,,,,,,,,,,,,,,,,,,,,,,,,,,,,,,,,,,,,,,,
A.1.16,Direct and indirect foreign investment in Indian companies – meaning,A.1.16,16," Investment in Indian companies can be made by both non-resident as well as resident Indian entities. Any non-resident investment in an Indian company is direct foreign investment. Investment by resident Indian entities could again comprise both resident and non-resident investments. Thus, such an Indian company would have indirect foreign investment if the Indian investing company has foreign investment in it. The indirect investment can also be a cascading investment, i.e. through multi-layered structure.",,,,,,,,,,,,,,,,,,,,,,,,,,,,,,,,,,,,,,,,,,,,,,,,,,,,,,,,,,,,,,,,,,,,,,,,,,,,,,,,,,,,,,,,,,,,,,,,,,,,,,,,,,,,,,,,,,,,,,,,,,,,,,,,,,,,,,,,,,,,,,,,,,,,,,,,,,,,,,,,,,,,,,,,,,,,,,,,,,,,,,,,,,,,,,,,,,,,,,,,,,,,,,,,,,,,,,,,,,,,,,,,,,,,,,,,,,,,,,,,,,,,,,,,,,,
A.1.17,Issue of Non convertible/ redeemable bonus preference shares or debentures,A.1.17,17,"To rationalise and simplify the procedures, an Indian company may issue non-convertible/redeemable preference shares or debentures to non-resident shareholders, including the depositories that act as trustees for the ADR/GDR holders, by way of distribution as bonus from its general reserves under a Scheme of Arrangement approved by a Court in India under the provisions of the Companies Act, as applicable, subject to no-objection from the Income Tax Authorities.

The above general permission to Indian companies is only for issue of non-convertible/ redeemable preference shares or debentures to non-resident shareholders by way of distribution as bonus from the general reserves. The issue of preference shares(excluding non-convertible/redeemable preference shares) and convertible debentures (excluding optionally convertible/partially convertible debentures) under the FDI scheme would continue to be subject to A.P. (DIR Series) Circular Nos.73 and 74 dated June 8, 2007 as hitherto",,,,,,,,,,,,,,,,,,,,,,,,,,,,,,,,,,,,,,,,,,,,,,,,,,,,,,,,,,,,,,,,,,,,,,,,,,,,,,,,,,,,,,,,,,,,,,,,,,,,,,,,,,,,,,,,,,,,,,,,,,,,,,,,,,,,,,,,,,,,,,,,,,,,,,,,,,,,,,,,,,,,,,,,,,,,,,,,,,,,,,,,,,,,,,,,,,,,,,,,,,,,,,,,,,,,,,,,,,,,,,,,,,,,,,,,,,,,,,,,,,,,,,,,,,,
A.1.18, Foreign Direct Investment in Limited Liability Partnership (LLP),A.1.18,18,"Limited Liability Partnership (LLP) formed and registered under the Limited Liability Partnership Act, 2008 shall be eligible to accept Foreign Direct Investment (FDI) under Government approval route, subject to the conditions given in Annex B.",,,,,,,,,,,,,,,,,,,,,,,,,,,,,,,,,,,,,,,,,,,,,,,,,,,,,,,,,,,,,,,,,,,,,,,,,,,,,,,,,,,,,,,,,,,,,,,,,,,,,,,,,,,,,,,,,,,,,,,,,,,,,,,,,,,,,,,,,,,,,,,,,,,,,,,,,,,,,,,,,,,,,,,,,,,,,,,,,,,,,,,,,,,,,,,,,,,,,,,,,,,,,,,,,,,,,,,,,,,,,,,,,,,,,,,,,,,,,,,,,,,,,,,,,,,
,,,,,,,,,,,,,,,,,,,,,,,,,,,,,,,,,,,,,,,,,,,,,,,,,,,,,,,,,,,,,,,,,,,,,,,,,,,,,,,,,,,,,,,,,,,,,,,,,,,,,,,,,,,,,,,,,,,,,,,,,,,,,,,,,,,,,,,,,,,,,,,,,,,,,,,,,,,,,,,,,,,,,,,,,,,,,,,,,,,,,,,,,,,,,,,,,,,,,,,,,,,,,,,,,,,,,,,,,,,,,,,,,,,,,,,,,,,,,,,,,,,,,,,,,,,,,,,
,,,,,,,,,,,,,,,,,,,,,,,,,,,,,,,,,,,,,,,,,,,,,,,,,,,,,,,,,,,,,,,,,,,,,,,,,,,,,,,,,,,,,,,,,,,,,,,,,,,,,,,,,,,,,,,,,,,,,,,,,,,,,,,,,,,,,,,,,,,,,,,,,,,,,,,,,,,,,,,,,,,,,,,,,,,,,,,,,,,,,,,,,,,,,,,,,,,,,,,,,,,,,,,,,,,,,,,,,,,,,,,,,,,,,,,,,,,,,,,,,,,,,,,,,,,,,,,
,,,,,,,,,,,,,,,,,,,,,,,,,,,,,,,,,,,,,,,,,,,,,,,,,,,,,,,,,,,,,,,,,,,,,,,,,,,,,,,,,,,,,,,,,,,,,,,,,,,,,,,,,,,,,,,,,,,,,,,,,,,,,,,,,,,,,,,,,,,,,,,,,,,,,,,,,,,,,,,,,,,,,,,,,,,,,,,,,,,,,,,,,,,,,,,,,,,,,,,,,,,,,,,,,,,,,,,,,,,,,,,,,,,,,,,,,,,,,,,,,,,,,,,,,,,,,,,
